Título,Data,URL,Conteudo
"Vice-presidente do Grupo Brasil-Israel, Alan Rick (AC) destaca boa relação construída entre os dois países nos últimos anos",01/03/2023,https://uniaobrasil.org.br/blog/2023/03/01/vice-presidente-do-grupo-brasil-israel-alan-rick-ac-destaca-boa-relacao-construida-entre-os-dois-paises-nos-ultimos-anos/,"Durante a instalação, nesta terça-feira (28), do Grupo Parlamentar Brasil-Israel, o vice-presidente do colegiado, senador Alan Rick (AC), ressaltou a importância da boa relação construída entre os dois países nos últimos anos e disse que, para o Brasil, é um grande passo trocar conhecimentos com uma das maiores referências mundiais em desenvolvimento humano, tecnológico e econômico. Entre os objetivos do grupo está o de atuar como um serviço de cooperação interparlamentar entre os Legislativos brasileiro e israelense.“Israel é uma das maiores referências em desenvolvimento humano, em tecnologia e em economia e em tanto tem abençoado as outras nações da Terra. Olha a importância desse intercâmbio, de respeito, entre as duas nações, e tão bem conduzido nos últimos anos”, destacou Alan Rick. “Além disso, o Brasil depende de nós para que possamos manter uma boa relação e contribuirmos para a defesa de Israel”, acrescentou.Durante seu discurso, o vice-presidente lembrou que, em 2017, quando era deputado federal, foi o responsável por propor uma sessão solene pelo aniversário de 69 anos do Estado de Israel. “Um ano antes, em 2016, estive em Israel, e conhecemos um grande projeto tecnológico na área de segurança pública. Temos buscado o estreitamento do apoio e da proteção ao Estado de Israel”, afirmou."
Elmar Nascimento é escolhido como primeiro líder do União Brasil na Câmara dos Deputados,01/03/2023,https://uniaobrasil.org.br/blog/2023/03/01/elmar-nascimento-e-escolhido-como-primeiro-lider-do-uniao-brasil-na-camara-dos-deputados/,"O deputado federal Elmar Nascimento foi anunciado oficialmente em 21 de fevereiro como líder do União Brasil na Câmara dos Deputados. Aos 51 anos, torna-se o primeiro líder do maior partido do Brasil, função que já exerceu no extinto Democratas em 2019.O parlamentar ocupará o cargo pelos próximos dois anos e tem como principais bandeiras o avanço social dos brasileiros e medidas que estimulem o desenvolvimento econômico. Entre elas, o Marco Legal das Ferrovias, o Marco Legal do Saneamento, o programa social Auxílio Brasil, a desoneração da folha de pagamento e o incentivo à navegação de cabotagem (transporte de cargas entre portos brasileiros)."
Luciano Bivar em artigo à Folha de PE: “Nenhuma empresa ou nenhum cidadão pode atuar à margem da lei”,01/03/2023,https://uniaobrasil.org.br/blog/2023/03/01/luciano-bivar-em-artigo-a-folha-de-pe-nenhuma-empresa-ou-nenhum-cidadao-pode-atuar-a-margem-da-lei/,"O presidente nacional do União Brasil, Luciano Bivar, em artigo de opinião publicado na Folha de Pernambuco, no dia de 21 de março, escreveu sobre a necessidade de responsabilização legal a provedores de redes sociais e aplicativos de mensagens e detalhou o PL 630/22, de sua autoria. Confira o texto na íntegra:O Estado de Direito requer normas para que se mantenha a civilidade. Não por acaso a justiça tem em seu simbolismo uma venda, uma balança e uma espada. Nada retrataria tão bem o significado da ciência do direito: a venda, para que o julgador não escolha a quem deva punir ou absolver; a balança, para que todos tenham pesos iguais e a espada, enfim, para que haja coação, posto que norma sem coação, como diz Von Hering, “é fogo que não queima, é tocha que não ilumina”.Vocé se aproveitar de ferramentas tão “letais” como as palavras e as imagens para disseminar mentiras é assassinar reputações e mentes, destruindo patrimônios morais construídos durante toda uma vida. Não posso acreditar que exista algo pior.Em outros tempos, guerreiros venciam batalhas usando as mais diversas armas, mas todas sempre expostas nos campos de luta. Embora visíveis, tais armas jamais conseguiriam vencer ideias e culturas, muito menos manipular mentes e coraçōes. Nos tempos de hoje, as armas são mais perigosas, justamente porque negam o caráter científico do direito.Foi movido pelo temor do que representam tais armas que apresentei o Projeto de Lei 630/22. Essa proposta obriga provedores de redes sociais e de aplicativos de mensagens a terem sede ou representante legal no Brasil, para que sejam responsabilizados caso infrinjam nosso ordenamento jurídico. Nenhuma empresa ou nenhum cidadão pode atuar à margem da lei.É preciso que se tenha consciência do perigo que certas ferramentas cibernéticas podem representar quando usadas para o mal. Podemos ser bombardeados por falsidades, psicopatias e crimes dos mais diversos sem sequer sabermos quem são os agressores.Mais perigosa ainda é a tentativa de fragilizar e desmoralizar as instituições democráticas de forma tão ardilosa. Nossa democracia é jovem, mas tem maturidade suficiente para resistir a este mal.Luciano Caldas Bivar"
"Carnaval de Salvador deve injetar R$ 1,8 bi na economia local",10/02/2023,https://uniaobrasil.org.br/blog/2023/02/10/carnaval-de-salvador-deve-injetar-r-18-bi-na-economia-local/,"Ministra do Turismo visitou a capital baiana para acompanhar os preparativos dos festejos; carnaval volta a ser realizado após dois anos de paralização para cumprimento dos protocolos sanitários de controle da Covid-19A ministra do Turismo, Daniela Carneiro (União Brasil), viajou até Salvador esta semana para um encontro com representantes do setor. Durante a passagem pela capital baiana, Daniela aproveitou para encontrar o prefeito de Salvador, Bruno Reis (União Brasil), e acompanhar os preparativos para o Carnaval de 2023 na cidade.Salvador espera receber 800 mil turistas durante a festa que deve injetar R$ 1,8 bilhão na economia local. No país inteiro, o turismo deve movimentar mais de R$ 8,1 bilhões durante o Carnaval, de acordo com a Confederação Nacional do Comércio de Bens, Serviços e Turismo. Também há previsão de cerca de 24,6 mil vagas de empregos temporários para o período.“Estou muito feliz de estar à frente desta Pasta que representa uma atividade que gera emprego e transforma vidas. E a Bahia merece um turismo cada vez mais forte e desenvolvido”, afirmou a ministra.Com dez dias, mais de 2,6 mil horas de música e cerca de 1 mil atrações – sendo mais de 600 nos circuitos oficiais e outras 400 espalhadas por dez bairros da capital -, a maior festa de rua do planeta retorna após dois anos de paralisação devido à pandemia de Covid-19. Com o tema “O Melhor Carnaval do Mundo Voltou”, as atrações do Carnaval de Salvador 2023 foram apresentadas na última terça-feira (07) pelo prefeito Bruno Reis.“Esse será o maior Carnaval em todas as áreas. Na contratação de atrações, na estrutura que a Prefeitura vai mobilizar. Os órgãos municipais ampliarão seus serviços. Faremos juntos o melhor Carnaval de todos os tempos. Estamos fazendo um forte movimento para reposicionar o Carnaval do Centro. Queremos trazer de volta a juventude para as ruas, e resgatar as origens e a força cultural do Carnaval. Temos novos produtos para fortalecer a festa. Também vamos dar destaque aos blocos afros, de índios e afoxés. Estamos fazendo investimentos expressivos para apoiar estas entidades”, declarou Bruno Reis.O chefe do Executivo explicou ainda que mais de 150 instituições receberão o apoio direto da Prefeitura, buscando fortalecer todo o arcabouço cultural da festa, garantindo a alegria do folião e a preservação da história.“Esse é o nosso maior potencial cultural. Então, são esses os dois pilares que devemos nos basear: reposicionar o Carnaval do Centro e fortalecer o lado cultural da festa, em especial com blocos que transmitem e refletem nossa história. E é por isso que tenho absoluta certeza de que faremos do Carnaval deste ano uma festa linda nas ruas de Salvador, tudo com muita alegria, segurança e comodidade para todos”, destacou.Operação de transportePara garantir o atendimento de transporte durante o período de Carnaval na cidade, a Secretaria de Mobilidade (Semob) preparou uma operação especial para quem vai curtir a folia. Entre a quinta-feira (16) e a terça-feira (21), os usuários poderão contar com o atendimento de linhas especiais, criadas exclusivamente para a folia, além dos serviços de táxi, mototáxi e ascensores, que terão atendimento modificado para atender quem vai curtir a festa.Ao todo, cerca de 800 prepostos irão trabalhar na operação, atuando no monitoramento, fiscalização e controle do transporte público. Cerca de 1,9 mil ônibus darão atendimento à cidade, tanto em linhas convencionais, de BRT e também do transporte complementar (STEC – amarelinhos). Serão mais de 10 mil rodoviários em atividade, atuando em 300 linhas envolvidas na operação, 80 delas com operação especial, circulando 24h durante todos os dias de Carnaval.Serviços de manutenção dos circuitosOs preparativos para o Carnaval 2023 envolvem uma série de ações preventivas nos circuitos por onde passarão trios e milhares de foliões durante os festejos. Nos últimos dias, a Secretaria de Manutenção da Cidade (Seman) intensificou iniciativas pontuais em diversos locais, executando serviços de poda de árvores, desobstrução de redes de drenagem, tapa-buracos em pavimentação asfáltica, colocação de tapumes e remoção de mobiliários urbanos.De acordo com o titular do órgão, Lázaro Jezler, o intuito é que as ruas estejam em plenas condições de receber o grande fluxo de pessoas durante os dias que ocorrerão a festa, oferecendo mais conforto e segurança. No período de folia, a Seman contará com sete equipes atuando em campo em esquema de plantão 24 horas, totalizando 135 profissionais.Com informações das Secretarias de Comunicação do Ministério do Turismo e da Prefeitura de Salvador"
Mato Grosso é estado com maior crescimento da Indústria em 2022,10/02/2023,https://uniaobrasil.org.br/blog/2023/02/10/mato-grosso-e-estado-com-maior-crescimento-da-industria-em-2022/,"O Estado de Mato Grosso alcançou um avanço expressivo no setor da Indústria em 2022. Enquanto quedas acentuadas foram registradas em diversas regiões do país, Mato Grosso fechou o ano com 19,4% de crescimento do setor. Os dados foram divulgados na Pesquisa Industrial Mensal (PIM Regional) do Instituto Brasileiro de Geografia e Estatística (IBGE).Administrado pelo governador Mauro Mendes (União Brasil), o estado apresentou os números positivos principalmente pelo comportamento dos setores de produtos alimentícios e de coque – produtos derivados do petróleo e biocombustíveis como o álcool etílico.Depois de Mato Grosso, Rio de Janeiro (4,6%), Amazonas (3,8%), Bahia (2,4%), Goiás (1,4%), Rio Grande do Sul (1,1%) e São Paulo (0,2%) foram os estados que conseguiram manter o índice de crescimento do setor positivo. As maiores quedas do ano foram registradas no Pará (-9,1%) e no Espírito Santo (-8,4%).Quando a avaliação é da série com ajuste sazonal, entre novembro e dezembro de 2022, Mato Grosso continua em primeiro lugar das expansões mais acentuadas, registrando 5,8% de crescimento. Em seguida, aparecem Amazonas (5,6%), Ceará (4,3%), Paraná (3,9%), Pernambuco (2,7%), Rio Grande do Sul (1,0%), Rio de Janeiro (0,8%), Santa Catarina (0,7%), Região Nordeste (0,6%) e Pará (0,5%)."
Mato Grosso gerou 57 mil novos postos de trabalho em 2022,09/02/2023,https://uniaobrasil.org.br/blog/2023/02/09/mato-grosso-gerou-57-mil-novos-postos-de-trabalho-em-2022/,"O Governo de Mato Grosso, administrado por Mauro Mendes (União Brasil), anunciou a geração de 57.354 novos postos de trabalho no ano de 2022. Nesse cenário, o estado tem a 6ª melhor performance no país na variação de saldos de empregos gerados. Foram admitidos 587.317 trabalhadores enquanto 529.963 foram desligados, um percentual positivo de 7,33%, acima da média nacional que foi de 5,01%.As informações do Cadastro Geral de Empregados e Desempregados (Caged) do Ministério do Trabalho mostram que a maioria dos contratados em Mato Grosso no ano passado são jovens de 18 a 24 anos com ensino médio completo.O setor de serviços foi o maior empregador, gerando 27.602 novos postos de trabalho, seguido pelo comércio que abriu 14.193 vagas. Em terceiro está a agropecuária com 7.609 empregos, depois vem a indústria com 4.056 vagas e por último a construção civil com 3.894 postos de trabalho.Dentre as cidades de Mato Grosso, Cuiabá foi a que mais abriu vagas com 14.579 novas contratações. Em seguida vem Rondonópolis, que gerou 5.512 empregos. Sinop está em terceiro lugar com 4.233 postos de trabalho, seguido por Sorriso com 3.935.O secretário de Estado de Desenvolvimento Econômico, César Miranda, aponta que as contratações pelo setor privado em Mato Grosso também são resultadas das ações do Governo, que tem investido na economia, atraindo empresas que passaram a ter mais segurança para expandir os negócios.“O Governo tem concedido créditos por meio da Desenvolve MT, desburocratizou o acesso aos benefícios fiscais no Estado, tem investido em logística melhorando rodovias para escoamento da nossa produção, organizado setores produtivos. Acreditamos que esse ano de 2023 teremos um desempenho ainda melhor na geração de emprego e renda”, exalta.| Com informações da Secretaria de Comunicação do Governo de Mato Grosso"
União Brasil: força e equilíbrio para pacificar o país,08/02/2023,https://uniaobrasil.org.br/blog/2023/02/08/uniao-brasil-forca-e-equilibrio-para-pacificar-o-pais/,"Há um ano, em 8 de fevereiro de 2022, era oficializado um dos maiores instrumentos democráticos do país: o União Brasil. Após a decisão unânime do Tribunal Superior Eleitoral (TSE), Democratas e PSL deram início a um movimento necessário de redução do número de siglas.Nascemos com o propósito de fortalecer a circulação de ideias na agenda política nacional. Os pontos que temos em comum são capazes de construir consensos e pacificar divergências que fazem parte do debate democrático. Afinal, não somos uma união apesar das diferenças. Somos uma união pelas diferenças.Desde a concepção, o projeto de país do União Brasil é ancorado pelo diálogo e pelo anseio de uma nação economicamente livre e socialmente justa. Sob o guarda-chuva do Estado Democrático de Direito, queremos somar esforços com o propósito de servir de caminho para a prosperidade que os brasileiros merecem ter.Nas eleições de 2022, o auge da participação popular, nos colocamos como uma alternativa. Ao todo, nossos candidatos angariaram mais de 35 milhões de votos. Elegemos 100 deputados estaduais, 59 deputados federais, cinco senadores (que se juntaram a outros quatro em meio de mandato) e quatro governadores. Assim, nos firmamos como força política no Brasil.Sabemos que as assembleias legislativas, a Câmara dos Deputados, o Senado Federal e os governos estaduais são os olhos da democracia. A pluralidade de ideias demonstra a diversidade do povo brasileiro. Por isso, nossos representantes têm autonomia e liberdade para exercerem seus mandatos, garantidos pelo voto popular.Apesar de sermos uma jovem democracia, contamos com instituições sólidas, que nos provam ter maturidade para resistir às intempéries antidemocráticas. O futuro certamente nos reserva avanços para as próximas gerações. Temos a força e o equilíbrio necessários para construir o Brasil dos nossos sonhos.Luciano Caldas BivarPresidente Nacional do União Brasil"
Goiás terá Delegacia Estadual de Combate à Violência Contra a Mulher,08/02/2023,https://uniaobrasil.org.br/blog/2023/02/08/goias-tera-delegacia-estadual-de-combate-a-violencia-contra-a-mulher/,"Ampliação do efetivo de policiais, maior integração e cooperação entre as forças de segurança e transformação da Delegacia Especializada de Atendimento à Mulher (Deam) de Goiânia em Delegacia Estadual de Combate à Violência Contra a Mulher. Essas foram algumas das medidas anunciadas durante apresentação realizada pelo governador Ronaldo Caiado (União Brasil), no Palácio das Esmeraldas, em Goiânia.“Tenho buscado resultados. É fundamental que tenhamos esse compromisso. O segundo mandato é mais desafiador do que o primeiro, pois exige de nós mais avanços. Não é sobre ter a sensação de segurança, mas é ter a certeza da segurança. Então, a responsabilidade é ainda maior”, afirmou o chefe do Executivo.O novo delegado-geral da Polícia Civil de Goiás, André Ganga, disse que pretende ampliar a Delegacia da Mulher de Goiânia, transformando-a em uma estrutura estadual.“Nossa ideia é ampliar seus tentáculos, transformá-la de uma delegacia municipal em estadual e padronizar procedimentos. Com isso, daremos um reforço para evitar crimes violentos contra mulheres”, explicou.Para ele, o chamamento de cerca de 900 policiais aprovados em concurso público deve contribuir para operacionalizar a mudança.| Com informações da Secretaria de Comunicação do Governo de Goiás"
Goiás bate recorde de matrículas na rede estadual de ensino,06/02/2023,https://uniaobrasil.org.br/blog/2023/02/06/goias-bate-recorde-de-matriculas-na-rede-estadual-de-ensino/,"O Governo de Goiás, administrado por Ronaldo Caiado (União Brasil), atingiu o maior número de matrículas para a rede estadual de ensino de toda a história.Em cinco dias, mais de 200 mil matrículas foram realizadas. Atualmente, o número de crianças prontas para acessar a rede pública de educação passa dos 520 mil.“Muito obrigado a todos os estudantes, e também suas famílias, que estão conosco na construção do nosso estado da educação”, escreveu o governador em suas redes sociais.“Os números mostram a vontade de estudar que nossos alunos têm e como estão confiantes no futuro do nosso estado”, acrescentou Caiado.| Foto: Hegon Corrêa| Com informações do Governo de Goiás"
Governo de Goiás lança programa para incentivar criação de empresas inovadoras,03/02/2023,https://uniaobrasil.org.br/blog/2023/02/03/governo-de-goias-lanca-programa-para-incentivar-criacao-de-empresas-inovadoras/,"O Governo de Goiás, administrado por Ronaldo Caiado (União Brasil), lançou o Programa de Pré-incubação e Mentoria e Apoio a Empreendimentos Inovadores (Pmaei) da Escola do Futuro do Estado (EFG). A iniciativa é voltada a startups e empreendedores de base tecnológica, e tem o objetivo de desenvolver e fomentar o ecossistema de inovação goiano.O edital busca pessoas que queiram empreender e precisam de ajuda para tirar sua ideia do papel, ou empreendedores que já tenham o seu negócio mas precisam de auxílio para desenvolver seu produto ou serviço de maneira inovadora. O edital é formado por duas frentes: o Programa de Mentoria e Apoio a Empreendimentos Inovadores (Pmaei) e o uso dos Ambientes de Inovação das EFGs.Os Ambientes de Inovação são compostos por três laboratórios. O InoveLab é um laboratório com equipamentos de última geração para o desenvolvimento de protótipos. A Pré-incubadora e Coworking são espaços para reuniões, estudo, trabalho, networking e compartilhamento de ideias. Já o Estúdio TV-Web de audiovisual é equipado com equipe técnica especializada para gravações em vídeo e áudio.Para orientar o desenvolvimento dos negócios, o Pmaei oferecerá mentorias nas áreas de Captação de Recursos, Administrativa e Financeira; Marketing, Comunicação e Vendas; Tecnologia e Inovação; Jurídica e Propriedade Intelectual.O ciclo de pré-incubação terá duração de quatro meses, com direito a até oito sessões individuais gratuitas de mentoria das áreas de interesse do candidato. As mentorias e o uso dos ambientes de inovação serão realizados de forma presencial nas instalações físicas das EFGs localizadas nos municípios de Goiânia, Aparecida de Goiânia e Santo Antônio do Descoberto.Para se inscrever o candidato precisa ser maior de idade, ter o ensino fundamental completo e ser proprietário ou sócio do negócio.A ideia ou projeto proposto deve obrigatoriamente ter caráter de inovação (conforme a Lei de Inovação – Lei Nº 10.973, de 2 de dezembro, de 2004). As inscrições devem ser feitas pelo site: https://efg.org.br/stais. O resultado preliminar sai em até 15 dias úteis após a inscrição do candidato.| Foto: Secretaria de Estado de Desenvolvimento e Inovação| Com informações da Secretaria de Estado de Desenvolvimento e Inovação do Governo de Goiás"
Escolas técnicas móveis reforçam ensino profissionalizante em Rondônia,03/02/2023,https://uniaobrasil.org.br/blog/2023/02/03/escolas-tecnicas-moveis-reforcam-ensino-profissionalizante-em-rondonia/,"As escolas técnicas móveis estão sendo fundamentais para o Governo de Rondônia cumprir metas de expansão da educação profissional, conforme o planejamento estratégico que visa garantir aos jovens e adultos uma nova oportunidade de inserção no mercado de trabalho através da formação profissional.O Governo de Rondônia, administrado por Marcos Rocha (União Brasil), destaca a importância quanto à aquisição de escolas técnicas móveis para levar ensino profissionalizante a alunos de todas as regiões do Estado, principalmente em comunidades remotas.As unidades flexíveis itinerantes oferecem cursos ministrados pelo Instituto Estadual de Desenvolvimento da Educação Profissional – Idep. Em 2022, as mesmas ofertaram cursos a 2.188 alunos de vários municípios rondonienses.Em 2021, foram inauguradas quatro unidades: Panificação e Confeitaria; Máquinas Pesadas e Agrícolas; Piscicultura e Frigorífico e Imagem Pessoal. Para o governador, a educação profissional tem capacidade transformadora tanto do indivíduo, quanto do desenvolvimento econômico.“Estamos massificando o ensino profissionalizante. Temos a convicção de que a educação profissional gera oportunidades, viabilizando o progresso econômico e o desenvolvimento social”, destacou o governador Marcos Rocha.| Com informações da Secretaria de Comunicação do Governo de Rondônia"
"“Estamos construindo um sólido caminho para desenvolver setores da economia no Amazonas”, destaca Wilson Lima",03/02/2023,https://uniaobrasil.org.br/blog/2023/02/03/estamos-construindo-um-solido-caminho-para-desenvolver-setores-da-economia-no-amazonas-destaca-wilson-lima/,"O Governador de Amazonas, Wilson Lima (União Brasil), afirmou nesta quinta-feira (02) que novas matrizes econômicas já são realidade no Amazonas. Na abertura dos trabalhos da 20ª legislatura da Assembleia Legislativa do Estado, o chefe do Executivo reforçou que o governo seguirá buscando fortalecer a Zona Franca de Manaus e priorizando as áreas social e geração de emprego e renda.“O desenvolvimento de novas matrizes econômicas deixou de ser discurso vazio, sem resultados práticos. Sem descuidar da defesa intransigente da Zona Franca de Manaus, estamos construindo um sólido caminho para desenvolver setores como o do gás natural, mercado que ganhou um novo marco regulatório, quando nós, Governo do Estado e Assembleia Legislativa, quebramos o monopólio do gás”, destacou Wilson Lima.Ele lembrou que em 2021 foi aprovada a Lei nº 5.420 (a Lei do Gás), apresentada pelo Governo do Estado. A norma se tornou um novo marco legal do serviço de distribuição e comercialização de gás natural, e que tem a perspectiva de geração de, ao menos, 20 mil empregos diretos, em uma estimativa para sete anos. Atualmente, o estado do Amazonas já conta com o campo pelo Complexo do Azulão, localizado no município de Silves (a 204 quilômetros de Manaus).Wilson Lima enfatizou ainda que, em novembro de 2022, assinou decreto estabelecendo as cotas e a alocação dos créditos de carbono do estado que conta com mais de 809,6 milhões de toneladas de carbono equivalente (tCO2e) disponíveis para venda. Desta forma, o Amazonas está habilitado a captar mais de US$ 1,6 bilhão em recursos estrangeiros, criando assim uma nova matriz econômica e sustentável para a região.“Digo sem vaidade, mas também sem medo de errar, que não houve um dia sequer que tenhamos deixado de agir pelo bem do povo do Amazonas”, declarou o governador.| Com informações da Secretaria de Comunicação do Governo do Amazonas"
