Título,Data,URL,Conteudo
Escolas técnicas móveis reforçam ensino profissionalizante em Rondônia,03/02/2023,https://uniaobrasil.org.br/blog/2023/02/03/escolas-tecnicas-moveis-reforcam-ensino-profissionalizante-em-rondonia/,"As escolas técnicas móveis estão sendo fundamentais para o Governo de Rondônia cumprir metas de expansão da educação profissional, conforme o planejamento estratégico que visa garantir aos jovens e adultos uma nova oportunidade de inserção no mercado de trabalho através da formação profissional.O Governo de Rondônia, administrado por Marcos Rocha (União Brasil), destaca a importância quanto à aquisição de escolas técnicas móveis para levar ensino profissionalizante a alunos de todas as regiões do Estado, principalmente em comunidades remotas.As unidades flexíveis itinerantes oferecem cursos ministrados pelo Instituto Estadual de Desenvolvimento da Educação Profissional – Idep. Em 2022, as mesmas ofertaram cursos a 2.188 alunos de vários municípios rondonienses.Em 2021, foram inauguradas quatro unidades: Panificação e Confeitaria; Máquinas Pesadas e Agrícolas; Piscicultura e Frigorífico e Imagem Pessoal. Para o governador, a educação profissional tem capacidade transformadora tanto do indivíduo, quanto do desenvolvimento econômico.“Estamos massificando o ensino profissionalizante. Temos a convicção de que a educação profissional gera oportunidades, viabilizando o progresso econômico e o desenvolvimento social”, destacou o governador Marcos Rocha.| Com informações da Secretaria de Comunicação do Governo de Rondônia"
"“Estamos construindo um sólido caminho para desenvolver setores da economia no Amazonas”, destaca Wilson Lima",03/02/2023,https://uniaobrasil.org.br/blog/2023/02/03/estamos-construindo-um-solido-caminho-para-desenvolver-setores-da-economia-no-amazonas-destaca-wilson-lima/,"O Governador de Amazonas, Wilson Lima (União Brasil), afirmou nesta quinta-feira (02) que novas matrizes econômicas já são realidade no Amazonas. Na abertura dos trabalhos da 20ª legislatura da Assembleia Legislativa do Estado, o chefe do Executivo reforçou que o governo seguirá buscando fortalecer a Zona Franca de Manaus e priorizando as áreas social e geração de emprego e renda.“O desenvolvimento de novas matrizes econômicas deixou de ser discurso vazio, sem resultados práticos. Sem descuidar da defesa intransigente da Zona Franca de Manaus, estamos construindo um sólido caminho para desenvolver setores como o do gás natural, mercado que ganhou um novo marco regulatório, quando nós, Governo do Estado e Assembleia Legislativa, quebramos o monopólio do gás”, destacou Wilson Lima.Ele lembrou que em 2021 foi aprovada a Lei nº 5.420 (a Lei do Gás), apresentada pelo Governo do Estado. A norma se tornou um novo marco legal do serviço de distribuição e comercialização de gás natural, e que tem a perspectiva de geração de, ao menos, 20 mil empregos diretos, em uma estimativa para sete anos. Atualmente, o estado do Amazonas já conta com o campo pelo Complexo do Azulão, localizado no município de Silves (a 204 quilômetros de Manaus).Wilson Lima enfatizou ainda que, em novembro de 2022, assinou decreto estabelecendo as cotas e a alocação dos créditos de carbono do estado que conta com mais de 809,6 milhões de toneladas de carbono equivalente (tCO2e) disponíveis para venda. Desta forma, o Amazonas está habilitado a captar mais de US$ 1,6 bilhão em recursos estrangeiros, criando assim uma nova matriz econômica e sustentável para a região.“Digo sem vaidade, mas também sem medo de errar, que não houve um dia sequer que tenhamos deixado de agir pelo bem do povo do Amazonas”, declarou o governador.| Com informações da Secretaria de Comunicação do Governo do Amazonas"
Observatório Legislativo Brasileiro: União Brasil tem quatro dos dez parlamentares mais influentes do país,03/02/2023,https://uniaobrasil.org.br/blog/2023/02/03/observatorio-legislativo-brasileiro-uniao-brasil-tem-quatro-dos-dez-parlamentares-mais-influentes-do-pais/,"O União Brasil tem quatro dos dez parlamentares mais influentes da Câmara dos Deputados. Os dados foram divulgados nesta sexta-feira (03) pelo Observatório do Legislativo Brasileiro, centro de estudos ligado à Universidade Estadual do Rio de Janeiro (UERJ).Entre os deputados federais citados no ranking estão o líder da bancada do União Brasil na Câmara, Elmar Nascimento (BA), e os parlamentares Felipe Francischini (PR), Arthur Maia (BA) e Kim Kataguiri (SP). O desempenho dos deputados foi avaliado durante a 56ª Legislatura (2019-2022).O Observatório do Legislativo Brasileiro combina expertise acadêmica e ferramentas de análise de dados para acompanhar e avaliar o comportamento dos parlamentares no Congresso Nacional.Sediado do Instituto de Estudos Sociais e Políticos da UERJ, um dos principais centros de pesquisa e ensino de pós-graduação em Ciência Política e Sociologia do Brasil, o Observatório nasceu da junção do conhecimento teórico sobre a análise política parlamentar com a utilização de ferramentas de programação para a análise e divulgação de dados de interesse público."
Wilson Lima defende diálogo como base da gestão no Amazonas,02/02/2023,https://uniaobrasil.org.br/blog/2023/02/02/wilson-lima-defende-dialogo-como-base-da-gestao-no-amazonas/,"O Governador do Amazonas, Wilson Lima (União Brasil), tomou posse neste domingo (1º). De acordo com o gestor estadual, reeleito em 2022, o novo mandato será pautado pelo diálogo e por muito trabalho.Em publicação feita em seu perfil oficial após a cerimônia de posse, Wilson Lima enfatizou que seguirá trabalhando muito para entregar à população do Amazonas uma gestão eficiente e de qualidade.“Sou grato ao Amazonas, a esse povo que, mais uma vez, deposita a confiança de conduzir os destinos deste estado. Reforço meu compromisso de continuar entregando o meu melhor. Ainda temos muito a fazer. Vamos em frente!”, destacou.Wilson Lima disse que pretende criar soluções estratégicas para, em quatro anos, ter “um Estado com índices e indicadores melhores” que os atuais, com geração de empregos e a ampliação de programas sociais.Em entrevista ao portal G1, o governador do Amazonas afirmou que pretende ampliar a oferta de postos de trabalho a partir da proteção da Zona Franca de Manaus, além de fomentar matrizes econômicas importantes para o Estado, como o gás natural, o potássio, o turismo e a bioeconomia.“A gente vai focar no social e na geração de emprego. No social, o Auxílio Estadual Permanente que vamos ampliar para mais 50 mil famílias e os nossos restaurantes populares do ‘Prato Cheio’. Na geração de emprego, vamos priorizar a proteção da Zona Franca de Manaus e no fomento de matrizes econômicas, como o gás natural, o potássio, o turismo e a bioeconomia”, explicou ao portal de notícias.Nas eleições de 2022, o Governador Wilson Lima se tornou o candidato mais votado de toda a história do Amazonas. Com 1.039.192 de votos, conseguiu quebrar o próprio recorde, conquistado em 2018.| Foto: Reprodução Instagram"
"“Meu compromisso é romper o ciclo da pobreza e fazer um estado que se fortaleça pela educação”, afirma Ronaldo Caiado",02/02/2023,https://uniaobrasil.org.br/blog/2023/02/02/meu-compromisso-e-romper-o-ciclo-da-pobreza-e-fazer-um-estado-que-se-fortaleca-pela-educacao-afirma-ronaldo-caiado/,"O Governador de Goiás, Ronaldo Caiado (União Brasil), reeleito em primeiro turno com 51,81% do votos, foi empossado para administrar a gestão estadual por mais quatro anos no último domingo (1º).Durante cerimônia realizada na Assembleia Legislativa de Goiás, o chefe do Executivo goiano reiterou o compromisso de trabalhar para a parcela mais vulnerável da população e de fortalecer a emancipação social.“Estou aqui hoje unicamente pelo desejo da população e pela importância da democracia, a quem reafirmo meu compromisso. Estou aqui hoje muito mais comprometido com Goiás do que estava em 1º de janeiro de 2019. Estou aqui hoje para seguir com o compromisso popular de romper o ciclo da pobreza e fazer um estado que se fortaleça pela educação”, ressaltou em discurso.Caiado estava acompanhado da primeira-dama do Estado, presidente de honra da Organização das Voluntárias de Goiás (OVG) e coordenadora do Gabinete de Políticas Sociais (GPS), Gracinha Caiado; de suas filhas Anna Vitória e Marcela, que juntas entregaram a faixa governamental ao pai.“Esperem o esforço diário com a construção de soluções, e não com a construção de muros. De mim, esperem pontes para atravessar”, destacou o governador.Em repouso relativo, em São Paulo (SP), por recomendação médica após passar por uma cirurgia de revascularização do miocárdio, no último dia 8 de dezembro, Caiado participou da cerimônia de forma remota. Ao usar a palavra, o governador agradeceu à equipe médica e aos goianos pelas orações que recebeu em função do seu quadro atual de saúde. “Estou me recuperando bem e em breve estarei no batente do dia a dia”, acrescentou.| Foto: Bianca Kida| Com informações da Secretaria de Comunicação do Governo de Goiás"
Rodrigo Cunha é eleito Segundo Vice-Presidente do Senado,02/02/2023,https://uniaobrasil.org.br/blog/2023/02/02/rodrigo-cunha-e-eleito-segundo-vice-presidente-do-senado/,"O senador Rodrigo Cunha (AL) foi eleito, nesta quarta-feira (1º), como segundo vice-presidente da Mesa Diretora do Senado Federal. A atuação no cargo prevê a substituição do presidente e do primeiro vice-presidente em casos de falta ou impedimentos.Neste contexto, caberá ao parlamentar convocar e presidir as sessões da Casa e as sessões conjuntas do Congresso Nacional, dar posse aos senadores e fazer comunicação de interesse do Senado e do país, a qualquer momento, no Plenário. Designar a Ordem do Dia das sessões deliberativas (definir os projetos que devem ir a votação, de acordo com as regras regimentais) e retirar matéria de pauta para cumprimento de despacho, correção de erro ou omissão no avulso eletrônico e para sanar falhas da instrução, além de decidir as questões de ordem.Também está prevista a possibilidade de decisão sobre a impugnação das proposições que lhe pareçam contrárias à Constituição, às leis, ou ao regimento, ressalvado ao autor recurso para o Plenário, que decidirá após audiência da Comissão de Constituição, Justiça e Cidadania (CCJ).O senador Rodrigo Cunha foi o deputado estadual mais votado de Alagoas no pleito de 2014, quando recebeu 60.759 votos. Em 2019, chegou ao Senado para cumprir seu primeiro mandato como parlamentar da Casa. Para o biênio de 2021 e 2022, foi eleito presidente da Comissão de Ciência, Tecnologia, Inovação, Comunicação e Informática."
Salvador terá escolas bilíngue e para crianças com transtorno do espectro autista,02/02/2023,https://uniaobrasil.org.br/blog/2023/02/02/salvador-tera-escolas-bilingue-e-para-criancas-com-transtorno-do-espectro-autista/,"O prefeito de Salvador, Bruno Reis (União Brasil), anunciou nesta quinta-feira (2), que implantará a Escola Infantil Bilíngue e a primeira Escola TEA, uma unidade especializada em atender crianças com Transtorno do Espectro Autista. O gestor também afirmou que 2023 será um ano definitivo para mitigar os efeitos da pandemia na educação, como a defasagem e o aumento da evasão escolar.“Sabemos que um dos piores efeitos da pandemia no Brasil, e no mundo, foi a defasagem no aprendizado e o aumento da evasão escolar. Nós não vamos aceitar isso. Para mitigar os danos, precisamos acelerar ainda mais as transformações em curso. Colocar todas as estruturas da Prefeitura no aprimoramento da escola. Para tornar as práticas em sala de aula mais atrativas, o currículo mais conectado à tecnologia e o aluno focado desde cedo na construção do seu futuro”, discursou.A Escola TEA visa ampliar as ações de ensino inclusivo da capital baiana e o projeto da Escola Infantil Bilíngue visa ofertar aos alunos da rede municipal o contato com línguas estrangeiras ainda na primeira infância, facilitando o aprendizado. “Tanto na creche como na pré-escola, nossas crianças vão passar a aprender em espanhol e em inglês, tendo assim a chance de ganhar aquela fluência natural num idioma estrangeiro que só a primeira infância permite”, disse.Educação DigitalBruno Reis destacou ainda a implantação de um inédito programa de Educação Digital em Salvador, com a entrega de 106 mil tablets com chip de conexão à internet para cada estudante do 1º ao 9º ano da rede municipal e a entrega de 8 mil chromebooks com chips para professores. Além disso, a distribuição de kits multimídia, assegurando um ambiente virtual de aprendizagem dentro e fora da escola.“Estamos ensinando às nossas crianças letramento digital, programação e até como produzir games. Como filho de professora, bem sei o quanto a educação oferece perspectivas de ascensão social para os filhos de família pobre. Para mim, a educação é uma verdadeira obsessão”, afirmou Bruno Reis.O prefeito aproveitou a oportunidade para citar entregas feitas no seu mandato. Foram 12 novas escolas construídas, mais a reforma e ampliação de outras 143. “Temos 15 novas em construção e outras 21 a iniciar. Salvador terá, até o fim do meu mandato, 48 escolas construídas. Ou seja, nossa cidade vai contar com uma nova escola a cada mês. Hoje, Salvador tem 85% da estrutura física renovada. Ao final do meu mandato chegará a quase 100%”, disse."
"Ajuste fiscal e melhoria da logística criaram credibilidade para investir em Mato Grosso, afirma Mauro Mendes",02/02/2023,https://uniaobrasil.org.br/blog/2023/02/02/ajuste-fiscal-e-melhoria-da-logistica-criaram-credibilidade-para-investir-em-mato-grosso-afirma-mauro-mendes/,"Em evento com investidores, governador do Mato Grosso destacou que Estado criou condições para atrais investimentos e empregosDurante o evento “XP Agro Conference”, em São Paulo, o governador Mauro Mendes (União Brasil) afirmou que o ajuste fiscal conquistado pelo Estado, bem como a melhoria na logística, são os principais fatores que levaram Mato Grosso a criar ambiência de negócios e atração de robustos investimentos privados.Mauro Mendes participou, nesta quarta-feira (1º), do painel “Infraestrutura, Logística e Trading do Agro”, junto do CEO da Rumo S/A, Beto Abreu; do chairman da Keppler Weber, Marcelo Lima; e do CEO da Alvean, Paulo Roberto de Souza.“Quando você tem equilíbrio fiscal, passa confiança. Ninguém investe em lugares onde o estado está desequilibrado, onde o Governo tem as contas atrapalhadas, pois é um ambiente de instabilidade e podem vir surpresas tributárias a qualquer momento, e isso afasta o investidor”, afirmou o governador, ao lembrar que em 2019 pegou um estado praticamente quebrado e conseguiu consertar as finanças já no primeiro ano de gestão.Além das contas em dia, de acordo com Mauro Mendes, as fortes ações em todas as áreas, especialmente na Infraestrutura, também colaboraram para que Mato Grosso recebesse investimentos do setor privado e passasse a ostentar o título de Estado com menor desemprego do país.“Investimos 19,6% da nossa receita em 2022. Estamos entre os estados brasileiros que mais investem. Com isso, a gente tem uma agenda forte de infraestrutura, que sempre foi o principal gargalo de Mato Grosso. Somente em asfalto novo, entregamos 2.500 km nos últimos quatro anos”, mencionou o gestor às dezenas de investidores presentes no evento.Para Mauro Mendes, outra ação que tem contribuído para a credibilidade do setor privado em Mato Grosso são as medidas tomadas pelo Governo para reduzir a burocracia e “destravar” projetos estruturantes, a exemplo da 1ª Ferrovia Estadual.Essa ferrovia vai ligar Rondonópolis a Cuiabá e também Rondonópolis a Nova Mutum e Lucas do Rio Verde, se conectando à malha nacional até chegar ao Porto de Santos (SP).“É preciso destravar o setor privado, para que ele possa fazer os investimentos. E foi exatamente o que aconteceu no caso da Rumo, que está construindo uma ferrovia que deve custar quase R$ 15 bilhões. Articulamos o destravamento dessa ferrovia na Assembleia e a empresa agora já está em obras. É um importante investimento logístico para o meu estado e para o Brasil. Esse é apenas um exemplo de dezenas de outros aonde o papel do setor público é regulatório, é licenciatório”, citou.Mauro Mendes ressaltou que levou essa demanda de “destravar” obras ao presidente Luiz Inácio Lula da Silva em reunião realizada com governadores na última semana.“Falei ao presidente Lula que se o Governo Federal atualizar o marco legal de licenciamento, vai destravar dezenas e centenas de projetos. Há muitos projetos em todo o país atolados na burocracia. Isso depende de vontade e determinação, e se houver isso a economia pode crescer de 4% a 5% só com essas medidas”, finalizou.| Com informações da Secretaria de Comunicação do Governo de Mato Grosso"
Goiás lidera geração de emprego no Centro-Oeste em 2022,02/02/2023,https://uniaobrasil.org.br/blog/2023/02/02/goias-lidera-geracao-de-emprego-no-centro-oeste-em-2022/,"Estado criou 87 mil vagas de emprego com carteira assinada no ano passado, reflexo dos bons resultados, principalmente, nos setores de serviços e comércioGoiás encerrou o ano de 2022 com saldo positivo de 87.719 postos de trabalho formais com carteira assinada, números que garantiram ao Estado a liderança da geração de emprego em toda a região Centro-Oeste. Administrado por Ronaldo Caiado (União Brasil), Goiás obteve saldo positivo ao longo de quase todo o ano, fator que demonstrou a força e a importância dos setores de serviços e comércio para a economia.Somente o primeiro, que engloba, por exemplo, prestação de serviços como segurança, limpeza, finanças e turismo, gerou 47.453 vagas de trabalho formais em 2022. Em segundo lugar, o comércio gerou 16.443 oportunidades. Na sequência estão indústria, com 9.024 vagas; construção, com 8.826; e a agropecuária, com 5.943 vagas.Para o governador Ronaldo Caiado, Goiás está no caminho certo ao aliar políticas de transferência de renda e de incentivo ao emprego, por meio de qualificação profissional e apoio às empresas e ao cooperativismo.“Por mais que tenhamos transferência de renda, isso não vai levar nunca ao combate com eficiência da pobreza. O que tira o cidadão da dependência é o emprego, a dignidade, o salário próprio, poder sustentar sua família”, afirmou.| Com informações da Secretaria de Comunicação do Governo de Goiás"
Rodrigo Cunha é eleito Segundo Vice-Presidente do Senado,01/02/2023,https://uniaobrasil.org.br/blog/2023/02/01/rodrigo-cunha-e-eleito-segundo-vice-presidente-do-senado-2/,"O senador Rodrigo Cunha (AL) foi eleito, nesta quarta-feira (1º), como segundo vice-presidente da Mesa Diretora do Senado Federal. A atuação no cargo prevê a substituição do presidente e do primeiro vice-presidente em casos de falta ou impedimentos.Neste contexto, caberá ao parlamentar convocar e presidir as sessões da Casa e as sessões conjuntas do Congresso Nacional, dar posse aos senadores e fazer comunicação de interesse do Senado e do país, a qualquer momento, no Plenário. Designar a Ordem do Dia das sessões deliberativas (definir os projetos que devem ir a votação, de acordo com as regras regimentais) e retirar matéria de pauta para cumprimento de despacho, correção de erro ou omissão no avulso eletrônico e para sanar falhas da instrução, além de decidir as questões de ordem.Também está prevista a possibilidade de decisão sobre a impugnação das proposições que lhe pareçam contrárias à Constituição, às leis, ou ao regimento, ressalvado ao autor recurso para o Plenário, que decidirá após audiência da Comissão de Constituição, Justiça e Cidadania (CCJ).O senador Rodrigo Cunha foi o deputado estadual mais votado de Alagoas no pleito de 2014, quando recebeu 60.759 votos. Em 2019, chegou ao Senado para cumprir seu primeiro mandato como parlamentar da Casa. Para o biênio de 2021 e 2022, foi eleito presidente da Comissão de Ciência, Tecnologia, Inovação, Comunicação e Informática.| Com informações da Agência Senado"
Conheça os Senadores do União Brasil,01/02/2023,https://uniaobrasil.org.br/blog/2023/02/01/conheca-os-senadores-do-uniao-brasil/,"Nesta quarta-feira (1º), os senadores que exercerão seus mandatos a partir da 57ª  Legislatura tomaram posse no Congresso Nacional. Com a chegada de cinco novos parlamentares, o União Brasil no Senado vai contar com 10 representantes na Casa.Ex-presidente do Congresso Nacional, Davi Alcolumbre foi reeleito no Amapá. No Paraná, Sergio Moro ficou com a vaga, assim como Efraim Filho, na Paraíba. Professora Dorinha e Alan Rick serão os representantes do Tocantins e do Acre, respectivamente.Além dos eleitos, os senadores Jayme Campos (MT), Marcio Bittar (AC), Rodrigo Cunha (AL) e Soraya Thronicke (MS) têm mandato até 2027.É papel do senador legislar, fiscalizar, autorizar, julgar e aprovar autoridades indicadas para exercer cargos específicos – verificando se os nomes escolhidos preenchem requisitos constitucionais. Conhecido como Casa Revisora, o Senado também carrega a prerrogativa de rever e avaliar propostas de projetos que tramitam no Congresso Nacional e já foram apreciados pela Câmara dos Deputados.Além disso, é nesta Casa Legislativa que são julgados os possíveis crimes de responsabilidade cometidos por membros do Executivo Federal, do Supremo Tribunal Federal, do Conselho Nacional de Justiça, do Conselho Nacional do Ministério Público, do Procurador-Geral da República e do Advogado-Geral da União.Conheça os nossos Senadores:AcreALAN RICKMÁRCIO BITTARAlagoasRODRIGO CUNHAAmapáDAVI ALCOLUMBREMato GrossoJAYME CAMPOSMato Grosso do SulSORAYA THRONICKETocantinsPROFESSORA DORINHA ParaíbaEFRAIM FILHOParanáSERGIO MORO"
Conheça os Deputados Federais do União Brasil,01/02/2023,https://uniaobrasil.org.br/blog/2023/02/01/conheca-os-deputados-federais-do-uniao-brasil/,"Nesta quarta-feira (1º), os deputados federais que exercerão seus mandatos na 57ª  Legislatura tomaram posse no Congresso Nacional. O União Brasil conta com 59 representantes na Casa.Bahia, Rio de Janeiro e São Paulo têm as maiores bancadas, com seis parlamentares cada. Ceará, Paraná e Rondônia aparecem com quatro em cada estado, seguido de Acre, Minas Gerais e Pernambuco, com três deputados por Unidade da Federação.Há ainda representantes eleitos nos estados de Alagoas, Amazonas, Goiás, Maranhão, Mato Grosso, Pará, Paraíba, Rio Grande do Norte, Rio Grande do Sul, Roraima, Sergipe e Tocantins.É papel do deputado federal legislar e fiscalizar. Os parlamentares que ocupam cargos na Câmara dos Deputados podem alterar, revogar e propor novas leis. Também é responsabilidade dos membros desta Casa discutir e votar medidas provisórias protocoladas pelo Poder Executivo, apreciar o orçamento da União, e fiscalizar a execução dos recursos públicos pelos demais órgãos.Conheça nossos Deputados Federais: AcreCORONEL ULYSSESDR EDUARDO VELLOSOMEIRE SERAFIMAlagoasALFREDO GASPARAmazonasFAUSTO SANTOS JRSAULLO VIANNABahiaARTHUR MAIADEPUTADO DALELMAR NASCIMENTOJOSÉ ROCHALEUR LOMANTO JRPAULO AZICearáDANILO FORTEDAYANY DO CAPITÃOFERNANDA PESSOAMOSES RODRIGUESGoiásDR ZACHARIAS CALILSILVYE ALVESMaranhãoJUSCELINO FILHO (Ministro das Comunicações)DR. BENJAMIN (Suplente)PEDRO LUCAS FERNANDESMinas GeraisDELEGADO MARCELO FREITASRAFAEL SIMOESRODRIGO DE CASTROMato GrossoCORONEL ASSISFÁBIO GARCIAParáCELSO SABINOParaíbaDR. DAMIÃOPernambucoFERNANDO FILHOLUCIANO BIVARMENDONÇA FILHOParanáDELEGADO MATHEUS LAIOLAFELIPE FRANCISCHINIGERALDO MENDESPADOVANIRio de JaneiroCHIQUINHO BRAZÃODANI CUNHADANIELA CARNEIRO (Ministra do Turismo)RENATO ABRÃO (Suplente)JUNINHO DO PNEUMARCOS SOARESMURILLO GOUVEARio Grande de NorteBENES LEOCÁDIOPAULINHO FREIRERondôniaCRISTIANE LOPESDR FERNANDO MÁXIMOLEBRÃOMAURÍCIO CARVALHORoraimaNICOLETTIPASTOR DINIZRio Grande do SulLUIZ CARLOS BUSATOSanta CatarinaFABIO SCHIOCHETSergipeRODRIGO VALADARESYANDRA MOURASão PauloALEXANDRE LEITEDAVID SOARESFELIPE BECARIKIM KATAGUIRIFERNANDO MARANGONIROSÂNGELA MOROTocantinsCARLOS GAGUIM"
