Título,Data,URL,Conteudo
Padovani (União-PR) é eleito 1º vice-presidente da Comissão de Integração Nacional e Desenvolvimento Regional,12/04/2023,https://uniaobrasil.org.br/blog/2023/04/12/padovani-uniao-pr-e-eleito-1o-vice-presidente-da-comissao-de-integracao-nacional-e-desenvolvimento-regional/,"Em discurso, deputado federal defende que diálogo com o Executivo facilitará andamento de pautas que beneficiarão a populaçãoA Comissão Permanente de Integração Nacional e Desenvolvimento Regional da Câmara dos Deputados elegeu como 1º vice-presidente, por unanimidade, o deputado Padovani (União-PR), que classificou o colegiado como “de grande representatividade para estados e municípios”.Em seu primeiro discurso na comissão, Padovani evidenciou problemas enfrentados no Brasil. “Somos um país de tamanho continental, com carência de logística, uma presença expressiva no agro que alimenta cerca de um bilhão e meio de pessoas pelo mundo. Temos uma deficiência na administração de portos e aeroportos, que estão longe do ideal para um país deste tamanho”, ressaltou.Padovani falou ainda sobre a necessidade da criação de mecanismos para alavancar a economia do país. O deputado citou a Frente Parlamentar Mista de Logística e Infraestrutura (FRENLOGI) como alternativa para criar no país um canal bioceânico que ligue o porto de Paranaguá (PR) ao porto de Antofagasta, no Chile.“Nós precisamos urgentemente realizar a integração do Brasil através do Oceano Atlântico ao Oceano Pacífico. Vamos diminuir de 33 mil quilômetros a nossa logística de escoamento de soja e outros grãos e carne para próximo de três mil quilômetros”, argumentou.O deputado acredita no poder que a comissão terá no diálogo com o Executivo. Através de discussões sobre projetos de lei, audiência pública e demais mecanismos, a tendência, segundo Padovani, é que projetos importantes sejam votados com celeridade. “Temos que avançar junto às comissões de Transporte, Agricultura e tantas outras desta Casa para que o Brasil se desenvolva e nós deixemos um marco da nossa atuação à frente deste Parlamento”, complementou."
Marangoni (União-SP) apresenta projeto que permite a revista de alunos em escolas,12/04/2023,https://uniaobrasil.org.br/blog/2023/04/12/marangoni-uniao-sp-apresenta-projeto-que-permite-a-revista-de-alunos-em-escolas/,"Segundo deputado federal, objetivo do PL 1528/2023 é coibir escalada de atos violentos pelo paísO deputado federal Marangoni (UNIÃO-SP) apresentou projeto de lei (PL 1528/2023) que permite a inspeção de malas, mochilas e maletas de estudantes do ensino fundamental e médio ao entrarem nas escolas. Com a proposta, o parlamentar pretende modificar o Estatuto da Criança e do Adolescente.Para a garantia de segurança, o texto reforça que as instituições de ensino devem fornecer as condições necessárias para um espaço escolar mais seguro. O objetivo, segundo Marangoni, é evitar novos ataques e ameaças. “Assistimos atônitos a diversos episódios violentos onde alunos matam professores, ferem colegas e expõem a comunidade escolar ao risco. Escola não é lugar para armas. O Estado não pode permanecer inerte diante de tantas tragédias, tem de haver repressão”, afirmou.Na avaliação do deputado, a imagem e a privacidade do aluno devem ser preservadas, mas o direito coletivo deve se sobrepor ao individual quando houver risco iminente. “O direito à segurança deve prevalecer, sempre respeitando a dignidade dos estudantes. É dever de todos os órgãos estatais, incluindo as entidades que atuam na área de educação, garantir a execução dessas políticas”, argumentou Marangoni ao alertar sobre a importância de coibir a entrada de drogas e artefatos que coloquem em risco a comunidade escolar."
Rodrigo Valadares alerta sobre segurança em escolas e creches após massacre em Blumenau,06/04/2023,https://uniaobrasil.org.br/blog/2023/04/06/rodrigo-valadares-alerta-sobre-seguranca-em-escolas-e-creches-apos-massacre-em-blumenau/,"Deputado federal defende presença de seguranças armados em instituições de ensino de todo o paísO deputado federal Rodrigo Valadares (União-SE) chamou atenção para a segurança pública em escolas e creches após o ataque ocorrido em uma creche de Blumenau (SC), na última quarta-feira (5). O episódio resultou na morte de quatro crianças, causando comoção e indignação em todo o país.Em suas declarações, o parlamentar ressaltou a importância do Estado tomar medidas para proteger crianças e jovens de futuras tragédias.“A escalada de violência e ataques às escolas é um sinal preocupante de problemas sociais. É preciso que haja uma reavaliação da legislação penal e das políticas de segurança em creches e escolas”, afirmou o deputado, que lamentou o ocorrido e prestou solidariedade às famílias das vítimas.Rodrigo Valadares sugeriu ainda a presença de seguranças armados nas escolas e creches públicas e privadas de todo o país, como forma de garantir a segurança de professores e alunos dentro das instituições de ensino.“A presença de seguranças armados em escolas e creches fará com que potenciais agressores pensem duas vezes antes de realizar ataques. Além disso, garantirá uma resposta rápida e eficaz em caso de ameaça violenta e tranquilizará alunos, pais e professores”, argumentou.A segurança nas escolas e creches tem sido discutida amplamente no país, especialmente após sucessivos episódios de violência registrados nos últimos anos. Para Valadares, a proteção dos alunos e funcionários dessas instituições deve ser prioridade para as autoridades, garantindo ambiente seguro para o aprendizado e convívio social."
Zacharias Calil (União-GO) é o novo coordenador da Frente Parlamentar da Primeira Infância,04/04/2023,https://uniaobrasil.org.br/blog/2023/04/04/zacharias-calil-uniao-go-e-o-novo-coordenador-da-frente-parlamentar-da-primeira-infancia/,"Grupo será instalado na terça-feira (11), na Câmara dos DeputadosA fiscalização das ações relacionadas a crianças de 0 a 6 anos é o objetivo principal da Frente Parlamentar Mista da Primeira Infância. As atividades iniciarão na última terça-feira, 11 de abril, com a instalação do grupo sob coordenação do deputado federal Zacharias Calil (União-GO). Segundo Calil, há legislação, orçamento e projetos suficientes para que o período da Primeira Infância seja desenvolvido da melhor maneira possível para as crianças brasileiras. “Mas é preciso fiscalizar essas ações, conferir como, quando e se estão sendo realizadas”, diz o novo coordenador da Frente.Para Zacharias Calil, que é médico pediatra, a primeira infância deve ser levada mais a sério no país visando a formação de gerações de brasileiros mais bem desenvolvidos educacionalmente, socialmente e afetivamente. “Este período entre a gestação e o 6º ano de vida é a janela onde toda a capacidade cognitiva e emocional da criança se desenvolve. É quando cada vivência e descoberta é registrada no cérebro e isso é levado para sempre na vida da pessoa”, explica.Frente Parlamentar Mista da Primeira InfânciaA Frente Parlamentar Mista da Primeira Infância é um agrupamento suprapartidário criado em 2013 com o objetivo de organizar os parlamentares defensores da Infância. O grupo foi o responsável pela articulação que viabilizou a criação do Marco Legal da Primeira Infância (Lei 13.257, de 8 de março de 2016).Em 2019, a Frente Parlamentar passou a ser organizada em coordenações regionais a partir da de um novo estatuto que também permitiu a integração de organizações parceiras, com o objetivo de ampliar a capacidade técnico-científica e de mobilização da Frente.Atualmente, a Frente conta com a participação de 240 parlamentares, entre deputadas, deputados, senadoras e senadores."
Lei de Rodrigo Cunha (União-AL) que determina funcionamento 24h de delegacias da mulher é sancionada,04/04/2023,https://uniaobrasil.org.br/blog/2023/04/04/lei-de-rodrigo-cunha-uniao-al-que-determina-funcionamento-24h-de-delegacias-da-mulher-e-sancionada/,"Aprovada pelo Senado em março, norma prioriza atendimento às vítimas de violência em sala reservada e por policiais do sexo femininoA lei que cria novas unidades e determina o funcionamento 24 horas por dia de Delegacias Especializadas de Atendimento à Mulher (DEAM), inclusive em fins de semana e feriados, foi sancionada nesta terça-feira (4) pelo Presidente da República. O texto foi apresentado em 2020 pelo senador Rodrigo Cunha (União-AL) e aprovado pelo Senado Federal em 7 de março.Segundo prevê a nova legislação, o atendimento às vítimas deverá ser feito, preferencialmente, em sala reservada e por policiais do sexo feminino. A regra deve ser obedecida não só pelas delegacias que serão criadas, mas também por aquelas que já existem. Na avaliação do parlamentar, manter o serviço sempre disponível encoraja mais mulheres a registrar ocorrência.“Nos finais de semana é quando [as mulheres] mais precisam [desse atendimento]. E uma mulher que é vítima de uma violência numa sexta-feira à noite teria que esperar até segunda-feira para receber um atendimento especializado”, argumentou Rodrigo Cunha, durante discussão em plenário no mês passado.Outro ponto da regra estabelece que o Fundo Nacional de Segurança Pública da União poderá financiar a criação de DEAMs. Já nos municípios onde não houver uma repartição especializada, os recursos podem ser destinados para oferecer treinamento adequado aos policiais encarregados. O objetivo é permitir o acolhimento humanizado das vítimas e disponibilizar número de telefone ou outro meio de mensagem eletrônica que permita o acionamento imediato da polícia em casos de violência contra a mulher.Também ficará a cargo das delegacias especializadas a assistência psicológica e jurídica à mulher vítima de violência, o que pode ocorrer por meio de convênios com a Defensoria Pública, órgãos do Sistema Único de Assistência Social, Juizados de Violência Doméstica e Familiar contra a Mulher ou varas criminais competentes."
Deputados do União Brasil participam de sessão solene pelo Dia Mundial de Conscientização sobre o Autismo,03/04/2023,https://uniaobrasil.org.br/blog/2023/04/03/ao-vivo-camara-realiza-sessao-solene-pelo-dia-mundial-de-conscientizacao-sobre-o-autismo/,"Felipe Becari, Marangoni e Silvye Alves cobram execução de políticas públicas já existentes sobre o temaOs deputados federais Marangoni (União-SP) e Silvye Alves (União-GO) defendem que uma fatia do Orçamento da União seja destinado ao acompanhamento de pessoas diagnosticadas com transtorno do espectro autista (TEA). Os parlamentares são autores do pedido de sessão solene que ocorreu nesta segunda-feira (3), em alusão ao Dia Mundial de Conscientização sobre o Autismo. No Brasil, estima-se que cerca de 2 milhões de pessoas possuem o espectro.Segundo Marangoni, eventos como esse são importantes para “chamar a atenção dos governos”. “Precisamos sair do discurso para o recurso. Não adianta a gente reconhecer como deficiência, ter a carteira que reconhece o diagnosticado, se as políticas públicas não forem efetivadas na ponta”, ressaltou.O parlamentar é autor do PL 889/2023 que busca garantir, de acordo com padrões internacionais, prioridade nas consultas e diagnósticos de pessoas com TEA. “Estamos cobrando também que o governo federal crie uma ação orçamentária específica dentro dos ministérios do Desenvolvimento Social, da Educação e da Saúde para desenvolver ações para acolher, tratar, dar dignidade e qualidade de vida para as pessoas diagnosticadas com TEA e suas famílias”, completou.“Fomentar política pública”Ao citar o episódio em que uma jovem autista do Rio de Janeiro sofreu bullying dentro da escola, Silvye Alves defendeu que a informação seja ferramenta para superar o preconceito. “Escolarização é na escola, educação é em casa. Queria muito que os governos e o Congresso Nacional abraçassem essa causa. São pessoas que necessitam do básico. Às vezes, os pais sequer têm acesso a atendimento e diagnóstico. Temos que fomentar uma política pública junto ao governo federal de qualquer jeito. Autismo não tem cura, mas todos merecem ter dignidade e qualidade de vida”, enfatizou a deputada.Presidente da Frente Parlamentar de Proteção às Pessoas com Transtorno do Espectro Autista, o deputado Felipe Becari (União-SP) garantiu que o Congresso Nacional está disposto a trabalhar pelo tema. “Se preocupar só com números, só com a lei, não vai resolver. Vendo a realidade das famílias atípicas, eu vejo que as políticas públicas não são executadas. Na frente parlamentar, não vamos apenas falar de estatísticas e não fazer nada. Vamos fiscalizar e executar as políticas públicas já existentes nos estados e municípios”, assegurou."
Rodrigo Valadares é eleito 3º vice-presidente da Comissão de Comunicações,31/03/2023,https://uniaobrasil.org.br/blog/2023/03/31/rodrigo-valadares-e-eleito-3o-vice-presidente-da-comissao-de-comunicacoes/,"Na última reunião da Comissão de Comunicações (CCOM), que ocorreu na última quarta-feira (29), o deputado Rodrigo Valadares foi eleito como o novo 3º vice-presidente da comissão. A eleição aconteceu por unanimidade, sendo uma indicação do líder do partido União Brasil.O parlamentar é conhecido por seu trabalho em defesa das liberdades individuais e da livre expressão, especialmente no âmbito das mídias digitais. Em seu discurso após a eleição, o deputado afirmou que pretende trabalhar em conjunto com os demais membros da comissão para aprimorar a legislação e garantir que as comunicações no país sejam livres e democráticas.A CCOM é uma comissão permanente da Câmara dos Deputados, responsável por discutir e deliberar sobre temas relacionados às áreas de comunicação social, telecomunicações, informática e internet. Em suas redes sociais, Rodrigo Valadares comemorou a eleição e afirmou que irá trabalhar para fortalecer a liberdade de expressão nos meios de comunicação do Brasil. “Estou muito feliz e honrado em ter sido eleito para essa importante posição na CCOM. Vamos trabalhar duro, com os demais membros, para criar um ambiente que aprimore a legislação e garanta que as comunicações no Brasil sejam livres e democráticas”, escreveu o deputado."
"Maioria dos deputados federais defende imposto único, bandeira do União Brasil",29/03/2023,https://uniaobrasil.org.br/blog/2023/03/29/maioria-dos-deputados-federais-defende-imposto-unico-bandeira-do-uniao-brasil/,"Para Luciano Bivar, atual sistema tributário sobrecarrega classes menos favorecidas e representa entrave na geração de empregosLevantamento do g1 aponta que 277 deputados federais são a favor da criação de imposto único, que reúna PIS/COFINS, ICMS e outros atualmente existentes. Essa é a uma das principais bandeiras defendidas pelo União Brasil na proposta de reforma tributária.“Nosso entendimento é que o atual sistema tributário sobrecarrega as classes menos favorecidas e representa um entrave na geração de empregos. Simplificar é mais que necessário, é urgente”, argumenta o presidente nacional do partido, deputado Luciano Bivar (PE).Além da simplificação tributária, o entendimento do União Brasil é que a retomada econômica está diretamente ligada à universalização e combate à evasão, ao respeito à autonomia de estados, municípios e DF e à desburocratização e modernização dos processos tributários. “É cláusula pétrea do União Brasil: a gente não vota aumento de imposto. Chance zero de votar qualquer tipo de aumento de imposto”, enfatiza o líder do União na Câmara, deputado Elmar Nascimento (BA).O sentimento da bancada no Senado é semelhante, segundo o líder Efraim Filho (PB). “Não votaremos reforma tributária para aumentar imposto. A gente já paga imposto demais. A gente já vive um sistema de extorsão tributária, onde se deposita muito peso nos ombros de quem produz e de quem paga imposto”, completa o senador.Mudança de visãoNo início da legislatura passada, em 2019, 52% dos deputados federais defendiam a adoção do Imposto sobre Valor Agregado (IVA), cobrança adotada em países como Estados Unidos e Alemanha que unifica tributos federais, estaduais e municipais para impedir o chamado “efeito cascata”. O percentual de quem desaprovava a proposta era maior há quatro anos: 16%."
Fausto Santos Jr. (União-AM) quer alterar regras da Tarifa Social para diminuir conta de energia elétrica,23/03/2023,https://uniaobrasil.org.br/blog/2023/03/23/fausto-santos-jr-uniao-am-quer-alterar-regras-da-tarifa-social-para-diminuir-conta-de-energia-eletrica/,"A proposta foi sugerida pelo deputado estadual Mário César Filho (União-AM)Nesta quarta-feira (22), o deputado federal Fausto Santos Júnior (União-AM) apresentou projeto de lei para diminuir a tarifa de energia elétrica do estado do Amazonas. A sugestão de proposta para o legislativo federal se deu após denúncias sobre o aumento abusivo da conta de energia no Estado. De acordo com a Comissão de Defesa do Consumidor (CDC), a energia do Amazonas é considerada a segunda mais cara do Brasil.O PL 1346/2023 tem como objetivo alterar as regras da tarifa social. Atualmente, para ter o desconto máximo de 65%, o cidadão só poderia consumir, até 30 kWh por mês, isto é, ter apenas uma geladeira em casa.Além disso, serão feitos ajustes com outros descontos do programa, permitindo que a conta de luz fique mais barata.“Quero mudar a vida do consumidor amazonense. E essa medida vai valer tanto para a região Norte como para as demais regiões do Brasil”, destaca o deputado Fausto Santos Júnior.O que é a Tarifa Social?A Tarifa Social é um benefício do Governo Federal destinado às famílias de baixa renda. Para ter acesso ao programa, essa população precisa estar registrada no Cadastro Único, com renda familiar mensal por pessoa menor ou igual a meio salário mínimo nacional. Idosos acima de 65 anos ou pessoas com deficiência que recebem o Benefício de Prestação Continuada da Assistência Social – BPC, também tem direito ao desconto. Como é aplicado o desconto na legislação atual?O desconto é aplicado na conta do cliente cadastrado na tarifa de acordo com o consumo de energia mensal. Por exemplo, quem utiliza de 0 a 30 kWh, é aplicado o desconto de 65%.Famílias que usam de 31 a 100 kWh mês, recebem 40%; e, acima de 101 a 220 kWh, 10% na conta de luz. Quem é cadastrado, mas utiliza acima de 221 kWh, não tem direito a desconto.O que vai mudar?Para a parcela do consumo de energia elétrica inferior ou igual a 100 kWh/mês, o desconto será de 65%. Já o consumo entre 101 kWh/mês e 250 kWh/mês, o desconto será de 40%. Para a parcela do consumo compreendida entre 251 kWh/mês e 460 kWh/mês, o desconto será de 20%. Para a parcela do consumo superior a 460 kWh/mês, não haverá desconto. Os cálculos dos descontos de que trata a presente Lei, aplicam-se aos consumidores residentes nas áreas de concessão das regiões Norte, Nordeste, Centro-Oeste, Sudeste e Sul.Caso a lei seja aprovada, a iniciativa em questão tem como finalidade dar maior alcance às famílias de baixa renda com a Tarifa Social e proporcionar um valor justo na conta de luz do amazonense."
"Em reposta a plano do PCC, Moro apresenta projeto que criminaliza ameaça contra agentes da lei",23/03/2023,https://uniaobrasil.org.br/blog/2023/03/23/em-reposta-a-plano-do-pcc-moro-apresenta-projeto-que-criminaliza-ameaca-contra-agentes-da-lei/,"Em discurso na tribuna do Senado, na tarde desta quarta-feira (22), o senador Sergio Moro (União-PR) agradeceu a atuação da Polícia Federal, Ministério da Justiça e demais instituições públicas que impediram a execução do plano da facção criminosa Primeiro Comando da Capital (PCC) de atacar sua família. Moro disse ainda que o Congresso Nacional não pode ficar inativo diante do crescimento das organizações no país e anunciou a apresentação de um projeto de lei (PL) sobre o tema. “Estamos assistindo atônitos a esses ataques que, na verdade, têm características terroristas e é próprio de organizações criminosas. Nós temos que intensificar o combate ao crime organizado”, afirmou Moro.O PL 1307/2023, apresentado por Moro, entre outras condutas, torna crime o ajuste ou o planejamento da prática de violência ou grave ameaça contra agentes da lei envolvidos no combate ao crime organizado. Pela proposta, passa a ser crime: “solicitar, mediante promessa ou concessão de vantagem de qualquer natureza, ou ordenar a alguém a prática de violência ou de grave ameaça contra ocupante de cargo público, advogado, parte, testemunha, intérprete ou perito particular, com o fim de impedir, embaraçar ou retaliar o regular andamento de processo ou investigação de crimes praticados por organização criminosa ou a aprovação de qualquer medida contra o crime organizado”, com prisão de quatro a 12 anos e recolhimento à presídio federal de segurança máxima.Além de Moro e sua família, eram alvos das ações criminosas servidores públicos e autoridades, que incluíam ações de homicídios e extorsão mediante sequestro, em pelo menos cinco unidades da Federação. “Minha avaliação sobre o crime organizado é: ou nós os enfrentamos ou quem vai pagar vai ser não só as autoridades, mas igualmente a sociedade. Isso tem que ser feito com políticas rigorosas, inteligentes, com base na lei, contra a criminalidade organizada. Nós não podemos nos render”, ressaltou. De acordo com o parlamentar pelo Paraná, o Brasil não pode retroceder na luta contra o fim do crime organizado e é preciso trabalhar por leis mais duras.Apartes em solidariedadeDurante seu discurso, Sergio Moro foi aparteado por colegas de diferentes partidos, todos em defesa do parlamentar e unânimes na necessidade de o Legislativo federal agir na coibição dos crimes. O líder do União Brasil no Senado, Efraim Filho (PB), destacou que o ataque a Moro é, na verdade, uma afronta ao Estado Democrático de Direito. Mais cedo, o senador emitiu nota, em nome do partido, ressaltando que é papel do Congresso dar “uma resposta legislativa rápida e rigorosa diante desses fatos”. Para o senador Rodrigo Cunha (AL), a Casa precisa voltar a discutir temas como a prisão em segunda instância e o foro privilegiado. “Essa Casa tem força suficiente para dar sua sinalização a esses acontecimentos. É preciso debater a prisão em segunda instância, se o foro privilegiado faz com que o crime compense. Eu sei que a impunidade o faz. Gostem ou não do senador Moro, vamos analisar o que aconteceu e a gravidade extrema da situação”. A senadora Soraya Thronicke (MS) elogiou o fato de a Polícia Federal agir com independência e acrescentou que as instituições públicas estão funcionando. “O que a gente pode extrair disso? É que as instituições estão funcionando por conta dessa operação da PF”. Já o senador Alan Rick (AC) lembrou que a Polícia Federal cumpriu seu dever e, assim, deve continuar fazendo, não somente com autoridades, mas com qualquer cidadão de bem. “O povo do Brasil todo se sentiu ameaçado diante dessa organização criminosa”.O diretório nacional do União Brasil também prestou solidariedade ao senador e parabenizou a “ação tempestiva” das autoridades que agiram para impedir a execução do plano. Na manhã desta quarta-feira (22), a Polícia Federal prendeu criminosos que planejavam matar autoridades, entre elas @sf_moro. Parabenizamos a ação tempestiva das forças de segurança e prestamos solidariedade ao senador e à sua família."
Professora Dorinha (União-TO) cobra retomada de construção de creches,17/03/2023,https://uniaobrasil.org.br/blog/2023/03/17/professora-dorinha-uniao-to-cobra-retomada-de-construcao-de-creches/,"“Congresso precisa agir”, disse a parlamentar na tribuna do Senado“Aumentar a fiscalização para que os recursos destinados à construção de creches tenham sua destinação garantida”. A senadora Professora Dorinha (União-TO) usou a tribuna do Senado, na quinta-feira (16), para cobrar atitude do Congresso Nacional quanto à paralisação de creches e escolas públicas no Brasil.A parlamentar convocou o protagonismo do Congresso Nacional na fiscalização dos recursos públicos aplicados. “É importante o Congresso assumir é que essas obras sejam concluídas”, afirmou. Segundo Dorinha, além de garantir os recursos, também é dos parlamentares a obrigação de fiscalizar a aplicação deles.Relatora da proposta de emenda à Constituição (PEC) que tornou o Fundo de Manutenção e Desenvolvimento da Educação Básica e de Valorização dos Profissionais da Educação (Fundeb) permanente, Dorinha lembrou que, se a criança não for atendida na educação infantil de forma correta, sofrerá enorme prejuízo em seu desenvolvimento neurológico. “Então, essa é uma tarefa importante que seja assumida”, frisouNa primeira semana de funcionamento das comissões, a Comissão de Educação aprovou a criação de um grupo de trabalho para debater o ensino médio e a reforma do ensino médio. Segundo a senadora, um dos principais desafios do colegiado é fazer com que o aluno veja o estudo como um preparo para o mercado de trabalho."
